{
  "schemaVersion": 2,
  "releaseId": "2026.10",
  "asOf": "2026-10-10",
  "created": "2026-10-06T00:00:00Z",
  "generatedBy": "core/release.js",
  "contents": [
    {
      "path": "data/football/balkancup/1929-31.json",
      "sha256": "40210917c0d21778d87cb63f1afa04e2541e468cd5f976333554c3b434a3a2e0",
      "schemaVersion": 2,
      "archetype": "encounter",
      "edition": "1929-31"
    },
    {
      "path": "data/football/balkancup/1931.json",
      "sha256": "9f06c79da81bf3456c262ea71a1b9e30b7acc4b7b658f203d110e66172399f6a",
      "schemaVersion": 2,
      "archetype": "encounter",
      "edition": 1931
    },
    {
      "path": "data/football/balkancup/1932.json",
      "sha256": "73a5385c253784e56b3dc71ab17cb3986a77b7f252aacc2f1cb8f161e7e2ece3",
      "schemaVersion": 2,
      "archetype": "encounter",
      "edition": 1932
    },
    {
      "path": "data/football/balkancup/1933.json",
      "sha256": "3ed81287f84cb86579c8319082537aa97dbce99e941506dc61e489484424ea1e",
      "schemaVersion": 2,
      "archetype": "encounter",
      "edition": 1933
    },
    {
      "path": "data/football/balkancup/1934-35.json",
      "sha256": "ac7f7786ae272fc883cb9be6fd72c3a6ac40b0cb2f763264224869d958ed5b1e",
      "schemaVersion": 2,
      "archetype": "encounter",
      "edition": "1934-35"
    },
    {
      "path": "data/football/balkancup/1935.json",
      "sha256": "a24ddce9664b493dcc9b227a3eeed1004779088987839838631c4bf5b34a8ba3",
      "schemaVersion": 2,
      "archetype": "encounter",
      "edition": 1935
    },
    {
      "path": "data/football/balkancup/1936.json",
      "sha256": "10ea465b912aa9718b27509d6d0957cd3e1e18855a157354c64aed07a7f903ad",
      "schemaVersion": 2,
      "archetype": "encounter",
      "edition": 1936
    },
    {
      "path": "data/football/balkancup/1946.json",
      "sha256": "8673c55505f42ae827de7d8961db5e25e26a3b785b86dde2a7442a7fd5854a9a",
      "schemaVersion": 2,
      "archetype": "encounter",
      "edition": 1946
    },
    {
      "path": "data/football/balkancup/1947.json",
      "sha256": "c3c54ca2519da84270af3a1810361a684f4e82a586925b4dc19dadedeedcdd0d",
      "schemaVersion": 2,
      "archetype": "encounter",
      "edition": 1947
    },
    {
      "path": "data/football/balkancup/1948.json",
      "sha256": "fc0b53b9a9f8f896d12fe216d253612c3060f2404071519f5f39e98bd74d6480",
      "schemaVersion": 2,
      "archetype": "encounter",
      "edition": 1948
    },
    {
      "path": "data/football/balkancup/1973-76.json",
      "sha256": "bc2cbaa48d1c15257e46e7c9532e310a7b492a7c00816736de930aa8b6870cc4",
      "schemaVersion": 2,
      "archetype": "encounter",
      "edition": "1973-76"
    },
    {
      "path": "data/football/balkancup/1977-80.json",
      "sha256": "e1803516e8edf5570742fdaddcf092f92bb6762fe4f21c2a098b11d16d95c072",
      "schemaVersion": 2,
      "archetype": "encounter",
      "edition": "1977-80"
    },
    {
      "path": "data/football/eurochamp/1960.json",
      "sha256": "b47b4bdaee9051688876234444b73405a16c18564211c525e18da26d589c00e1",
      "schemaVersion": 2,
      "archetype": "encounter",
      "edition": 1960
    },
    {
      "path": "data/football/eurochamp/1964.json",
      "sha256": "c6ccdb94f1733052ae5ea5425cb67dda650cabfea4dbe6618725ce3157d05412",
      "schemaVersion": 2,
      "archetype": "encounter",
      "edition": 1964
    },
    {
      "path": "data/football/eurochamp/1968.json",
      "sha256": "ceb01d115f9eac77b2ccecabbb4aa3eb29af014759f4af095ca5b50de6ba7a87",
      "schemaVersion": 2,
      "archetype": "encounter",
      "edition": 1968
    },
    {
      "path": "data/football/eurochamp/1972.json",
      "sha256": "2b4fefb583aa79be345187e5d9d8d6ddb780ecac689f8481eba24e180cfa3dc4",
      "schemaVersion": 2,
      "archetype": "encounter",
      "edition": 1972
    },
    {
      "path": "data/football/eurochamp/1976.json",
      "sha256": "c56f64125ce39f539deb549d46ef9584c2e9480bc94d9fbb00d2d1d885b27ce3",
      "schemaVersion": 2,
      "archetype": "encounter",
      "edition": 1976
    },
    {
      "path": "data/football/eurochamp/1980.json",
      "sha256": "659b3268f95f5967a0ac91f6caa5e8f1646ce59077bc6a2f35b31afaf211e5f0",
      "schemaVersion": 2,
      "archetype": "encounter",
      "edition": 1980
    },
    {
      "path": "data/football/eurochamp/1984.json",
      "sha256": "8fab18ce738ee8454e7c6ac247c529547e9fc8a1e7e51b403ee1a1ce3936d2d4",
      "schemaVersion": 2,
      "archetype": "encounter",
      "edition": 1984
    },
    {
      "path": "data/football/eurochamp/1988.json",
      "sha256": "bdbd9db34f1ca20efb859e9d0f17bfb96502d58528dcdec676d258039a9757fb",
      "schemaVersion": 2,
      "archetype": "encounter",
      "edition": 1988
    },
    {
      "path": "data/football/eurochamp/1992.json",
      "sha256": "9d5c2ee60f458c31c1cb16e9891d7adc1ac91eb8fafab29914e8a5e346c16896",
      "schemaVersion": 2,
      "archetype": "encounter",
      "edition": 1992
    },
    {
      "path": "data/football/eurochamp/1996.json",
      "sha256": "1ededc770fe15bd72fcfef4c88d8eb05f17635bf1010cd69c1c8b2a8c1541c98",
      "schemaVersion": 2,
      "archetype": "encounter",
      "edition": 1996
    },
    {
      "path": "data/football/eurochamp/2000.json",
      "sha256": "87a5e3df913da679c22019d2bb3c159e9fb18bc0e38d511e48dfe15954687eb1",
      "schemaVersion": 2,
      "archetype": "encounter",
      "edition": 2000
    },
    {
      "path": "data/football/eurochamp/2004.json",
      "sha256": "5abd6a9ca3afd23c2ddd147cf0ce8278d8f7fe652808a0e6ca489e50e874467a",
      "schemaVersion": 2,
      "archetype": "encounter",
      "edition": 2004
    },
    {
      "path": "data/football/eurochamp/2008.json",
      "sha256": "39321e435f9f2da920261d078927df797cdd63f0c7d4c6ea152a58276f65c83a",
      "schemaVersion": 2,
      "archetype": "encounter",
      "edition": 2008
    },
    {
      "path": "data/football/eurochamp/2012.json",
      "sha256": "60764dc96edfb4e06d9b29ceb107e67669f1ef04198740d4007cd9d053b9e1ec",
      "schemaVersion": 2,
      "archetype": "encounter",
      "edition": 2012
    },
    {
      "path": "data/football/eurochamp/2016.json",
      "sha256": "f0c467a8e9a1bf75e9abe42b281aa1c6ce6323ed9025fab458a599e983698d4a",
      "schemaVersion": 2,
      "archetype": "encounter",
      "edition": 2016
    },
    {
      "path": "data/football/eurochamp/2020.json",
      "sha256": "e734563c8462941305d12a81ed0ef2124d86e76e40865d84016ec2aedce59444",
      "schemaVersion": 2,
      "archetype": "encounter",
      "edition": 2020
    },
    {
      "path": "data/football/eurochamp/2024.json",
      "sha256": "7c468d8cfe153cdaebf983cb5a7c3056142914b65dec692b5790af4c7784aa86",
      "schemaVersion": 2,
      "archetype": "encounter",
      "edition": 2024
    },
    {
      "path": "data/football/intconcup/1992.json",
      "sha256": "496bc4e081be85c6797531faf29f8c0e6651d3a92e40a2cd4877f4b3390c648c",
      "schemaVersion": 2,
      "archetype": "encounter",
      "edition": 1992
    },
    {
      "path": "data/football/intconcup/1995.json",
      "sha256": "dcd278ad04fff1e8639b8c1400d5d75e817ea2e320b57b2b1b98ce4005bf0a05",
      "schemaVersion": 2,
      "archetype": "encounter",
      "edition": 1995
    },
    {
      "path": "data/football/intconcup/1997.json",
      "sha256": "e2c72504592a32952bb3e27b6da2b45a302ead3ee20b552325d5102ab3209239",
      "schemaVersion": 2,
      "archetype": "encounter",
      "edition": 1997
    },
    {
      "path": "data/football/intconcup/1999.json",
      "sha256": "f8fac5b0eb01b01af744f6acfaacbb4ff2396ce656bc1233050c381caf426deb",
      "schemaVersion": 2,
      "archetype": "encounter",
      "edition": 1999
    },
    {
      "path": "data/football/intconcup/2001.json",
      "sha256": "df5cfe314970eda1a607f06fa1a1c9f94b769ed2630cac828e262a9ff7497c52",
      "schemaVersion": 2,
      "archetype": "encounter",
      "edition": 2001
    },
    {
      "path": "data/football/intconcup/2003.json",
      "sha256": "f851a6033fbe7d2ba34d2f9f24423e61282e4673896cb758b026bcd434a6ea03",
      "schemaVersion": 2,
      "archetype": "encounter",
      "edition": 2003
    },
    {
      "path": "data/football/intconcup/2005.json",
      "sha256": "44161518d27ab4699f92becd0eef9d0bd2ea73374ac2150b06f87471723d02dd",
      "schemaVersion": 2,
      "archetype": "encounter",
      "edition": 2005
    },
    {
      "path": "data/football/intconcup/2009.json",
      "sha256": "609f8982b812031b719ba79754facf8abdb37afe9c2774adbcaf85b43e3a6bd3",
      "schemaVersion": 2,
      "archetype": "encounter",
      "edition": 2009
    },
    {
      "path": "data/football/intconcup/2013.json",
      "sha256": "116bf9d18778579f03081c8c567ed1a0b0d82f38e4a7124b117852872a1b5393",
      "schemaVersion": 2,
      "archetype": "encounter",
      "edition": 2013
    },
    {
      "path": "data/football/intconcup/2017.json",
      "sha256": "fc153ff2d41a20a60e0c3e2c011b0c091abd7536bf2f77466cf91193ad4fd67c",
      "schemaVersion": 2,
      "archetype": "encounter",
      "edition": 2017
    },
    {
      "path": "data/football/nordic/1924-28.json",
      "sha256": "65b6230a2c37e7dd06df12b044ec03226bca31e6554013a39fa2212c5f686e5d",
      "schemaVersion": 2,
      "archetype": "encounter",
      "edition": "1924-28"
    },
    {
      "path": "data/football/nordic/1929-32.json",
      "sha256": "a802ffc14f10d443f2b59ff6f609171e75d2879e4ec11ff314189f324d82f915",
      "schemaVersion": 2,
      "archetype": "encounter",
      "edition": "1929-32"
    },
    {
      "path": "data/football/nordic/1933-36.json",
      "sha256": "7b26ed9edf25fac8dcc8dacb4b030e5a29e45971f73187cfc6db01b31688d867",
      "schemaVersion": 2,
      "archetype": "encounter",
      "edition": "1933-36"
    },
    {
      "path": "data/football/nordic/1937-47.json",
      "sha256": "62d755b9592d5f0c58a7cc29ebeb0799d330e4602772c597a806fe7e609540d8",
      "schemaVersion": 2,
      "archetype": "encounter",